RAZAO_SOCIAL;UF;total_despesas;media_trimestral;desvio_padrao
UNIMED ITUIUTABA COOPERATIVA TRABALHO MÉDICO LTDA.;MG;79165291713;26388430571.0;11884412977.591969
PLADISA PLANOS DE SAÚDE SA;SC;78913190289;26304396763.0;11585711600.081467
SANTA CASA DE MISERICORDIA DE SAO JOAQUIM DA BARRA;SP;78301525715;26100508571.666668;12917825432.671164
UNIMED LAVRAS COOPERATIVA DE TRABALHO MÉDICO;MG;77952038737;25984012912.333332;22396619227.94257
UNIMED GUAXUPÉ COOPERATIVA DE TRABALHO MEDICO;MG;77897040312;25965680104.0;11843625748.052322
UNIMED ALTO DA SERRA - SOCIEDADE COOPERATIVA DE SERVIÇO MÉDICO LTDA.;RS;77390680941;25796893647.0;11430095341.434828
UNIMED NORTE PAULISTA - COOPERATIVA DE TRABALHO MÉDICO;SP;76786401699;25595467233.0;11598087195.694073
COOPERATIVA DE TRABALHO MEDICO REGIÃO DO PLANALTO SERRANO;SC;76768316501;25589438833.666668;12170226067.927979
AMAZÔNIA PLANOS DE SAÚDE LTDA;PA;76722802959;25574267653.0;11647823846.685152
UNIMED RIO VERDE COOPERATIVA TRABALHO MEDICO;GO;76170734441;25390244813.666668;23748552296.27776
COOPERATIVA DE TRABALHO MÉDICO DO PLANALTO NORTE DE SANTA CATARINA LTDA;SC;76103368305;25367789435.0;11372311809.487541
SAÚDE BRASIL ASSISTÊNCIA MÉDICA LTDA.;SP;75809556727;25269852242.333332;13497377569.769533
ASSOCIAÇÃO SÃO LUIZ SAÚDE;SP;75604865719;25201621906.333332;10204531442.410263
CAIXA DE ASSISTÊNCIA À SAÚDE DO SINDICATO DOS FUNCIONÁRIOS INTEGRANTES DO GRUPO OCUPACIONAL ADMINISTRAÇÃO TRIBUTÁRIA DO ESTADO DE PERNAMBUCO;PE;74225418458;24741806152.666668;12793574786.018093
AMHA SAUDE S/A;SP;73200626771;24400208923.666668;11695896916.449846
COOPERATIVA DE TRABALHO MEDICO DE ARAGUAÍNA - UNIMED ARAGUAÍNA;TO;73022283880;24340761293.333332;10351569907.818254
UNIMED MISSÕES/RS - COOPERATIVA DE ASSISTÊNCIA À SAÚDE LTDA.;RS;72450049052;24150016350.666668;35875411953.29043
UNIMED DE TAUBATÉ COOPERATIVA DE TRABALHO MÉDICO;SP;72429316732;24143105577.333332;9069618549.328121
UNIMED DE BIRIGUI - COOPERATIVA DE TRABALHO MÉDICO;SP;72118274594;24039424864.666668;11259516181.377586
ASSOCIAÇÃO SAÚDE SÃO JOSÉ;SC;71459612754;23819870918.0;10663998324.422916
UNIMED DE BARRETOS COOPERATIVA DE TRABALHO MÉDICO;SP;71190429598;23730143199.333332;10713654763.726704
UNIMED OESTE DO PARANA - COOPERATIVA DE TRABALHO MEDICO;PR;69365260442;23121753480.666668;17271443845.210934
UNITY SERVIÇOS INTEGRADOS DE SAÚDE LTDA.;DF;69283499035;23094499678.333332;12363908585.923824
UNIMED DE AVARÉ COOPERATIVA DE TRABALHO MÉDICO;SP;67951283936;22650427978.666668;10509515639.304707
UNIMED DE GUARATINGUETA-COOPERATIVA DE TRABALHO MÉDICO;SP;67754446702;22584815567.333332;22197464307.524506
UNIMED DE LORENA COOPERATIVA DE TRABALHO MÉDICO;SP;67679791942;22559930647.333332;9898347080.102743
UNIMED DE PINDAMONHANGABA - COOPERATIVA TRABALHO MEDICO;SP;67365897421;22455299140.333332;19027779551.60218
UNIMED COSTA VERDE RJ;RJ;67318730990;22439576996.666668;18648402982.66177
IRMANDADE DE MISERICÓRDIA DO HOSPITAL DA SANTA CASA DE MONTE ALTO;SP;65876467162;21958822387.333332;10863235658.732803
ANAFE SAUDE;GO;65733965697;21911321899.0;10296064049.431673
PREVIDENT ASSISTÊNCIA ODONTOLÓGICA S.A;SP;64149700178;21383233392.666668;6707978980.915167
CAIXA DE ASSISTÊNCIA AOS MEMBROS DA DEFENSORIA PÚBLICA DO ESTADO DO RIO DE JANEIRO;RJ;63911414165;21303804721.666668;10059091492.728708
ASSOCIAÇÃO POLICIAL DE ASSISTÊNCIA À SAÚDE;SP;63701419914;7077935546.0;8368089289.416738
FUNDAÇÃO LIBERTAS DE SEGURIDADE SOCIAL;MG;63621959417;21207319805.666668;18122737664.7631
UNIMED DE CAPIVARI -COOPERATIVA DE TRABALHO MÉDICO;SP;63033904475;21011301491.666668;9610718213.364727
UNIMED VERTENTE DO CAPARAÓ - COOPERATIVA DE TRABALHO MÉDICO LTDA;MG;61662217560;20554072520.0;7276824130.758837
IRMANDADE DE MISERICORDIA DE PORTO FERREIRA;SP;60267880090;20089293363.333332;10199150159.976784
UNIMED-RIO COOPERATIVA DE TRABALHO MEDICO DO RIO DE JANEIRO;RJ;60020112212;60020112212.0;
UNIMED SETE LAGOAS COOPERATIVA TRABALHO MÉDICO;MG;59952996962;29976498481.0;38209370036.95929
UNIMED CABO FRIO COOPERATIVA TRABALHO MÉDICO LTDA.;RJ;59369813491;19789937830.333332;14685548005.678497
UNIMED DE LENÇOIS PAULISTA - COOPERATIVA DE TRABALHO MÉDICO;SP;58794192147;19598064049.0;15038988181.33008
UNIMED VIÇOSA - COOPERATIVA DE TRABALHO MÉDICO;MG;57202607268;19067535756.0;9041857931.856668
UNIODONTO DE CAMPINAS COOPERATIVA ODONTOLÓGICA;SP;57176092429;19058697476.333332;14738870305.75621
UNIMED CATAGUASES COOPERATIVA DE TRABALHO MÉDICO LTDA;MG;57134666454;19044888818.0;8492994194.599174
UNIMED DE TUPA COOPERATIVA DE TRABALHO MÉDICO;SP;56671246024;18890415341.333332;8897138594.04115
OPERADORA DE PLANOS PRIVADOS DE SAÚDE - SANTA CASA SAÚDE LTDA;MS;56268081814;18756027271.333332;8648211606.285042
SANTA CASA DE MISERICÓRDIA DE VOTUPORANGA;SP;55543625262;18514541754.0;8332120715.9152
UNIMED NOROESTE FLUMINENSE - COOPERATIVA DE TRABALHO MÉDICO LTDA;RJ;55489389267;18496463089.0;17825378639.164494
UNIMED SÃO SEBASTIÃO DO PARAÍSO COOPERATIVA DE TRABALHO MÉDICO;MG;55365747545;18455249181.666668;8230282945.738483
INTERMEDICI PIRACICABA ASSISTENCIA MEDICA LTDA;SP;54938623769;18312874589.666668;8919739355.69225
UNIMED DE MINEIROS COOPERATIVA DE TRABALHO MÉDICO;GO;54337965708;18112655236.0;8313296369.1883955
UNIMED TRÊS CORAÇÕES COOPERATIVA DE TRABALHO MÉDICO LTDA.;MG;53700812688;17900270896.0;8436906922.571073
ASSOCIAÇÃO MAIS SAÚDE SANTA CASA DE SÃO JOÃO DA BOA VISTA;SP;53021547850;17673849283.333332;18555425830.685143
TEMPO MED PLANO DE SAUDE LTDA;SC;52379214393;17459738131.0;13056237974.93606
UNIODONTO DE SÃO JOSÉ DOS CAMPOS COOPERATIVA DE TRABALHO ODONTOLÓGICO;SP;51871363246;17290454415.333332;8202952245.5981865
ASSOCIAÇÃO PARANAENSE DE ASSISTÊNCIA À SAUDE DOS MEMBROS DO MINISTERIO PUBLICO DO PARANÁ;PR;50272275153;16757425051.0;7486474795.86559
FUNDAÇÃO FILANTRÓPICA E BENEFICENTE DE SAÚDE ARNALDO GAVAZZA FILHO;MG;49991704121;16663901373.666666;7930155494.500414
UNIMED PATROCÍNIO COOPERATIVA DE TRABALHO MÉDICO LTDA.;MG;49823342365;16607780788.333334;16548571667.862865
ÚNICA ASSISTENCIA MEDICA LTDA;SP;48439181535;16146393845.0;15594484154.743015
UNIMED VALE DO PIQUIRI-COOPERATIVA DE TRABALHO MÉDICO VALE DO PIQUIRI;PR;48022939805;16007646601.666666;7702307200.662113
BRASILDENTAL OPERADORA DE PLANOS ODONTOLÓGICOS S.A.;SP;47931792196;15977264065.333334;13794433194.761297
UNIMED SUL PAULISTA - COOPERATIVA DE TRABALHO MÉDICO;SP;46156311004;15385437001.333334;22954144075.04493
AMPARA ASSISTÊNCIA MÉDICA PARAÍSO LTDA;MG;45496229867;15165409955.666666;6732601843.995358
CAIXA DE ASSISTÊNCIA DOS EMPREGADOS DO BANEB;BA;44583975727;14861325242.333334;4468565573.969896
UNIMED REGIÃO DA CAMPANHA/RS - COOPERATIVA DE ASSISTÊNCIA À SAÚDE LTDA.;RS;44566934572;14855644857.333334;6927326669.192295
UNIMED CARATINGA - COOPERATIVA DE TRABALHO MÉDICO LTDA;MG;44076077804;14692025934.666666;12434388750.140314
FUNDAÇÃO FIAT SAÚDE E BEM ESTAR;MG;44050101088;14683367029.333334;5730580654.569049
UNIMED NORTE DO PARANÁ COOPERATIVA REGIONAL DE TRABALHO MÉDICO;PR;43770562379;14590187459.666666;14429754740.60881
SAMOC S.A. - SOCIEDADE ASSISTENCIAL MÉDICA E ODONTO CIRÚRGICA;RJ;43636966001;14545655333.666666;21618124640.846615
ELETROS SAÚDE - ASSOCIAÇÃO DE ASSISTÊNCIA À SAÚDE;RJ;43507228996;14502409665.333334;21871566522.46252
UNIMED DE SAO JOSÉ DO RIO PARDO-COOP. DE TRAB. MÉDICO;SP;43188140657;14396046885.666666;7211411414.040021
SUPERMED ADMINISTRADORA DE BENEFÍCIOS LTDA.;RJ;42693123768;14231041256.0;7763870998.014155
UNIMED NOROESTE DE MINAS COOPERATIVA DE TRABALHO MEDICO LTDA;MG;42428048519;14142682839.666666;12310845152.835533
UNIMED DE REGISTRO COOPERATIVA DE TRABALHO MÉDICO;SP;42342231360;14114077120.0;5501666259.833455
ASSOCIAÇÃO PLANO DE SAÚDE SANTA CASA DE VALINHOS;SP;42332636554;14110878851.333334;6282120764.423641
FUNDAÇÃO DE ASSISTÊNCIA À SAÚDE DA ASSOCIAÇÃO DO MINISTÉRIO PÚBLICO DO RIO GRANDE DO SUL;RS;41501739461;13833913153.666666;7397982369.245472
UNIMED LEOPOLDINA COOPERATIVA DE TRABALHO MÉDICO LTDA;MG;41129851464;13709950488.0;7453045240.319578
UNIMED PLANALTO CENTRAL/RS - COOPERATIVA DE ASSISTÊNCIA  À SAÚDE LTDA.;RS;40735864533;13578621511.0;11781702768.230421
INSTITUIÇÃO BENEFICENTE CEL MASSOT - IBCM;RS;40373693652;13457897884.0;9985623823.798176
UNIMED SUDOESTE DE MINAS COOPERATIVA DE TRABALHO MÉDICO;MG;40070581473;13356860491.0;6905389968.873112
PLAMER PLANO MEDICO RESENDE LTDA;RJ;39701560731;13233853577.0;5159727101.807442
UNIMED DE DRACENA - COOPERATIVA DE TRABALHO MÉDICO;SP;39586654872;13195551624.0;6337196437.964338
UNIMED VALE DO JAURU COOPERATIVA DE TRABALHO MÉDICO;MT;39173554775;13057851591.666666;9945626669.79107
UNIMED DE MONTE ALTO - COOPERATIVA DE TRABALHO MÉDICO;SP;38773889759;12924629919.666666;6033317477.338013
ASSOCIAÇÃO FCA SAÚDE;MG;38208180282;12736060094.0;4836290032.021807
ASSOCIACAO DOS PROFESSORES UNIVERSITÁRIOS DA BAHIA;BA;37959058068;12653019356.0;5529377036.126617
UNIMED TRÊS PONTAS - COOPERATIVA DE TRABALHO MÉDICO;MG;36939558092;12313186030.666666;5808467756.644773
PB ASSISTENCIA MEDICA EU LTDA;BA;36526889553;12175629851.0;6639071656.418175
UNIX SAÚDE S.A;BA;36496510589;12165503529.666666;5024621915.825165
ASSOCIAÇÃO DOS SERVIDORES MUNICIPAIS, ESTADUAIS E FEDERAIS DO RIO DE JANEIRO;RJ;36386387594;12128795864.666666;3492388265.8184004
UNIMED REGIÃO DA FRONTEIRA - RS COOPERATIVA DE ASSISTÊNCIA À SAÚDE LTDA.;RS;35968951105;11989650368.333334;5433508154.86039
CAIXA DE ASSISTÊNCIA DOS EMPREGADOS DO BANESE;SE;35839727458;11946575819.333334;4814637843.188793
TRINO - ALIANCA FILANTRÓPICA DE ASSISTÊNCIA E INTEGRAÇÃO PARA O DESENVOLVIMENTO DA SAUDE;ES;34950183588;11650061196.0;5727274369.338115
ASSOCIAÇÃO DOS EMPREGADOS DA COMPANHIA ESTADUAL DE HABITAÇÃO E OBRAS PÚBLICAS - ASSEC;SE;34749281587;11583093862.333334;5121791760.326062
ATÍVIA SERVIÇOS DE SAÚDE S/A;SP;34513769626;17256884813.0;3510693635.0325975
PRONTOCLINICA E HOSPITAIS SAO LUCAS S/A;MG;34492690934;11497563644.666666;10271555010.642101
UNIMED REGIONAL DE FLORIANO - COOPERATIVA DE TRABALHO MÉDICO;PI;34475869692;11491956564.0;5155583626.989833
ASSOCIAÇÃO DOS AUDITORES FISCAIS DA RECEITA ESTADUAL DO RIO DE JANEIRO;RJ;34187576699;11395858899.666666;4609150644.105164
ASSOCIAÇÃO SANTA CASA CLÍNICAS DE BIRIGUI;SP;34135712565;11378570855.0;5330797211.428894
UNIMED SUDOESTE PAULISTA COOPERATIVA DE TRABALHO MÉDICO;SP;33993109696;11331036565.333334;4883370744.169662
UNIODONTO BELÉM - COOPERATIVA DE ASSISTÊNCIA À SAÚDE ODONTOLÓGICA;PA;33736120099;11245373366.333334;5574646745.479055
IRMANDADE DA SANTA CASA DE MISERICÓRDIA DE PASSOS;MG;33181942492;11060647497.333334;8379715206.684513
ASSOCIAÇÃO POLICIAL DE ASSISTÊNCIA À SAÚDE DE ARAÇATUBA (APAS);SP;32645039643;10881679881.0;4291996719.963911
UNIMED DO BRASIL - CONF. NACIONAL DAS COOPERATIVAS MÉDICAS;SP;32404160970;10801386990.0;104762676.12006713
PESSOAL SAÚDE PLANOS DE ASSISTÊNCIA MÉDICA LTDA;SP;31902608377;10634202792.333334;4681074818.112829
UNIMED DE UBA COOPERATIVA DE TRABALHO MEDICO;MG;30993319238;10331106412.666666;7794956473.220436
CAIXA DE ASSISTÊNCIA DOS MAGISTRADOS DE PERNAMBUCO;PE;30265735227;10088578409.0;7945023989.327106
MAIS SAUDE S/A;ES;30226791216;15113395608.0;8180049491.66798
SANTA CASA DE MISERICORDIA HOSPITAL SÃO VICENTE;SP;30018281642;10006093880.666666;4943792940.725269
UNIODONTO DE FORTALEZA COOPERATIVA DE TRABALHO ODONTOLOGICO LTDA;CE;29559413598;9853137866.0;4554352885.805353
AME VVIDA PLANOS DE SAUDE INTEGRADO LTDA.;RO;29480494373;9826831457.666666;4137219760.370115
CONFERÊNCIA SÃO JOSÉ DO AVAÍ;RJ;29378821798;9792940599.333334;7651741076.179135
SOCIEDADE PORTUGUESA DE BENEFICÊNCIA;RS;28600077573;9533359191.0;4039976691.899782
UNIMED DE JATAÍ COOPERATIVA DE TRABALHO MÉDICO LTDA.;GO;28111983427;9370661142.333334;4207277143.403025
UNIMED ALFENAS COOPERATIVA DE TRABALHO MEDICO;MG;27462966357;9154322119.0;6824751230.285696
ASSOCIAÇÃO POLICIAL DE ASSISTÊNCIA À SAÚDE DE RIBEIRÃO PRETO (APAS);SP;27116095015;9038698338.333334;8827404194.059374
UNIMED DO OESTE DA BAHIA COOPERATIVA DE TRABALHO MÉDICO;BA;26766223495;8922074498.333334;3170007976.1148915
SANTA CASA DE SAÚDE - SCS;ES;25792730562;8597576854.0;3896366429.2906623
UNIODONTO PORTO ALEGRE COOPERATIVA ODONTOLOGICA LTDA;RS;25725730194;8575243398.0;4868612162.787727
UNIODONTO MACEIÓ COOPERATIVA ODONTOLÓGICA;AL;25123913947;8374637982.333333;3993785607.376245
AMERON - ASSISTÊNCIA MÉDICA RONDÔNIA S/A. - EM LIQUIDAÇÃO EXTRAJUDICIAL;RO;24747476926;8249158975.333333;198139049.2137279
AURORA SAÚDE LTDA;MG;24624463222;8208154407.333333;4465958290.855744
DESBAN - FUNDAÇÃO BDMG DE SEGURIDADE SOCIAL;MG;24427783647;8142594549.0;3529616286.0038853
UNIODONTO PIRACICABA - COOPERATIVA ODONTOLÓGICA;SP;24004333484;8001444494.666667;3920013690.6634355
ATITUDE SAÚDE ASSISTÊNCIA MEDICA LTDA;BA;23879590949;7959863649.666667;4235017807.078141
UNIMED VALE DO CARANGOLA COOPERATIVA DE TRABALHO MEDICO LTDA;MG;22909436359;7636478786.333333;3535103126.254284
UNIMED SÃO JOÃO NEPOMUCENO COOPERATIVA DE TRABALHO MÉDICO LTDA.;MG;22640502194;7546834064.666667;3523426637.846074
SOCIEDADE BENEFICENTE DEZOITO DE JULHO;MG;22469002411;7489667470.333333;5610080341.688011
VIDA TOP MAIS SAÚDE OPERADORA DE PLANOS DE SAÚDE LTDA.;SP;21518320229;7172773409.666667;3687037163.882938
ON MED ASSISTÊNCIA MÉDICA LTDA;RS;21012859225;7004286408.333333;4844396095.278459
HOSPITAL DE PRONTOCLINICA LTDA.;RS;20842749005;6947583001.666667;5849926533.96192
COOPERATIVA DOS USUÁRIOS DE SERVIÇOS DE SAÚDE DO VALE DO RIO DOS SINOS LTDA;RS;20631829251;6877276417.0;3051651130.386483
RIO DOCE SAÚDE;ES;20375338408;6791779469.333333;3234918027.2604423
IRMANDADE DA SANTA CASA DE MISERICÓRDIA E MATERNIDADE DONA ZILDA SALVAGNI;SP;19933374638;6644458212.666667;9859296450.648344
UNIODONTO REGIONAL COOPERATIVA ODONTOLOGICA;MG;19541078321;6513692773.666667;6794351961.520118
UNIMED ALTO SÃO FRANCISCO COOPERATIVA DE TRABALHO MÉDICO;MG;18619396401;6206465467.0;5724021956.4148445
SUL DO PARÁ LTDA;PA;18466588138;6155529379.333333;4892245606.136587
R.M.I. OPERADORA DE SAÚDE INTEGRADA LTDA;SP;18188481489;9094240744.5;2521129546.386983
UNIODONTO DE JOÃO PESSOA COOPERATIVA ODONTOLÓGICA;PB;17633811596;5877937198.666667;2484160334.8609033
UNIMED REGIONAL DE PICOS - COOPERATIVA DE TRABALHO MÉDICO;PI;17567264765;5855754921.666667;2661320031.3953633
TOTAL ASSISTÊNCIA MÉDICA HOSPITALAR LTDA;MG;17260821316;5753607105.333333;3013079002.5152607
FUNDAÇÃO PLAMHUV - PLANO MÉDICO HOSPITALAR DOS HOSPITAIS UNIDOS DE VIÇOSA;MG;16952556025;5650852008.333333;2734042742.295331
OPLAN SAÚDE OPERADORA DE PLANO DE SAÚDE LTDA;RJ;16754346938;5584782312.666667;2892036191.407721
ASSOCIAÇAO UNISAUDE MARAU;RS;16412478014;5470826004.666667;4573394793.427462
UNIODONTO DO BRASIL CENTRAL NACIONAL DAS COOPERATIVAS ODONTÓLOGICAS;SP;16302394177;5434131392.333333;2977406272.4083433
UNIMED SOUSA - COOPERATIVA DE TRABALHO MÉDICO;PB;16189677553;5396559184.333333;2168505214.043527
UNIODONTO PAULISTA-FEDERAÇÃO DAS COOPERATIVAS ODONTOLÓGICAS DO ESTADO DE SÃO PAULO;SP;16133324344;5377774781.333333;2636235818.431499
UNIMED ALTO JACUÍ/RS - COOPERATIVA DE ASSISTÊNCIA À SAÚDE LTDA;RS;16110937844;5370312614.666667;4016665008.5730195
MEDGOLD ASSISTENCIA MEDICA LTDA - ME;MG;16037126443;5345708814.333333;1813870379.2817209
PORTOMED - PORTO SEGURO SERVIÇOS DE SAUDE LTDA;SP;14751093589;4917031196.333333;4330944030.507196
ODONTO EMPRESAS CONVENIOS DENTARIOS LTDA.;SP;14735939128;4911979709.333333;3595128226.5796347
UNIODONTO DE MANAUS - COOPERATIVA ODONTOLÓGICA LTDA.;AM;14384262384;4794754128.0;2179373333.328967
UNIMED DE BATATAIS - COOPERATIVA DE TRABALHO MÉDICO;SP;14369299907;4789766635.666667;1907169208.973822
CAIXA DE ASSISTÊNCIA À SAÚDE DOS TRABALHADORES NAS INDÚSTRIAS METALÚRGICAS, MECÂNICAS E DO MATERIAL ELÉTRICO DE BRUSQUE;SC;14179778304;4726592768.0;2153761279.220363
UNIMED MACHADO COOPERATIVA DE TRABALHO MEDICO;MG;14052458752;4684152917.333333;3479206502.564945
ASSOCIACAO DE SAUDE HOLAMBRA;SP;14032674737;4677558245.666667;2489633174.1801023
AME-ASSISTÊNCIA MÉDICA A EMPRESAS LTDA;MG;13659953236;4553317745.333333;1789722890.9774969
UNIMED CAMPO BELO- COOPERATIVA DE TRABALHO MÉDICO;MG;12904786446;4301595482.0;3604826542.818918
ASSOCIAÇÃO POLICIAL DE ASSISTENCIA À SAUDE DE SAO JOAO DA BOA VISTA;SP;12450305687;4150101895.6666665;1967637981.6352909
SISTEMA TOTAL DE SAÚDE LTDA.;SP;11674826761;3891608920.3333335;3288654686.3503776
VOCÊ TOTAL PLANOS DE SAÚDE LIMITADA;SP;11605082629;3868360876.3333335;3026637729.855465
ODONTO SEG OPERADORA DE PLANOS ODONTOLOGICOS S.A.;SP;11460868303;3820289434.3333335;3852179444.8047166
COMSEDER - COOPERATIVA DE ASSISTÊNCIA MÉDICA DOS SERVIDORES DA SUPLAN E DO DER LTDA;PB;11381562854;3793854284.6666665;1544209493.7709167
ASSOCIACAO POLICIAL DE ASSISTENCIA A SAUDE DE ITAPETININGA;SP;11271540801;3757180267.0;1610775304.8271813
UNIODONTO UBERABA - COOPERATIVA DE ASSISTÊNCIA À SAÚDE ODONTOLÓGICA LTDA;MG;10874631493;3624877164.3333335;1786214884.1828537
S1 OPERADORA DE PLANO DE SAÚDE LTDA;DF;10641994670;3547331556.6666665;1729228167.0679424
ASSOCIACAO CIVIL PRÓ-SAÚDE DOS SERVIDORES DA UNIVERSIDADE ESTADUAL DE PONTA GROSSA;PR;10515659180;3505219726.6666665;1653015606.6510098
DONA SAÚDE CLINICAS LTDA;SP;10395636205;3465212068.3333335;507404842.3750128
UNIODONTO DE AMERICANA COOPERATIVA ODONTOLÓGICA;SP;10316128283;3438709427.6666665;2968326090.7216744
TELOS - FUNDAÇÃO EMBRATEL DE SEGURIDADE SOCIAL;RJ;9601818246;3200606082.0;1875561325.5917773
ASSOCIAÇÃO DO FISCO DE ALAGOAS;AL;9442605514;3147535171.3333335;2264409025.85352
UNIODONTO DE SOROCABA COOPERATIVA ODONTOLÓGICA;SP;8998225590;2999408530.0;1552212447.0441463
ASSOCIAÇÃO BENEFICENTE CATÓLICA;MG;8836110394;2945370131.3333335;2166553103.4815946
PERSONAL CARE OPERADORA DE SAÚDE SA;SP;8799987950;4399993975.0;1430994030.7771587
CARING SAÚDE ASSISTÊNCIA MÉDICA LTDA.;RJ;8796438858;2932146286.0;1385202691.4953237
PRONTO SOCORRO CONDE DE MOREIRA LIMA;SP;8746403909;2915467969.6666665;2838235424.334179
ASSOCIAÇÃO UNIVIDA SANTA RITA DO PASSA QUATRO;SP;8735347675;2911782558.3333335;2490112983.6332912
AFFIX ADMINISTRADORA DE BENEFÍCIOS LTDA;SP;8652352852;2884117617.3333335;2747545878.4059153
UNIODONTO DE ARARAQUARA COOPERATIVA ODONTOLÓGICA;SP;8586817468;2862272489.3333335;1408579232.2130451
ASSOCIAÇÃO POLICIAL DE ASSISTÊNCIA À SAÚDE DE BARRETOS;SP;8465189158;2821729719.3333335;1255919359.5503876
CAIXA BENEFICENTE DOS FUNCIONÁRIOS DO GRUPO IGUAÇU;PR;8338578041;2779526013.6666665;1084352128.0559576
UNIODONTO DE JUNDIAÍ COOPERATIVA ODONTOLÓGICA;SP;8334348120;2778116040.0;1214459894.2012682
DENTAL CENTER LTDA;PB;7551091082;2517030360.6666665;1146869879.4855065
SD-M OPERADORA DE PLANOS DE SAUDE LTDA;RJ;7488521855;2496173951.6666665;1128092492.8221867
SAMIG - SERV. DE ASSISTENCIA MEDICA DA ILHA DO GOVERNADOR LTDA;RJ;7447098790;2482366263.3333335;479206960.550186
PLAMESC PLANOS DE SAÚDE LTDA;RJ;7174411180;2391470393.3333335;1743312777.3160605
PORTO ALEGRE CLÍNICAS LTDA. - EM LIQUIDAÇÃO EXTRAJUDICIAL;RS;7137962316;7137962316.0;
SANTA CASA DE MISERICÓRDIA DE TUPÃ;SP;7121233998;2373744666.0;1724053524.33213
VALE PLANOS DE SAÚDE LTDA;PE;6992889961;2330963320.3333335;1701464061.3271074
XP ADMINISTRADORA DE BENEFÍCIOS LTDA.;SP;6983271856;2327757285.3333335;1156545176.070472
ASSOCIAÇÃO DOS SERVIDORES PÚBLICOS DA ADMINISTRAÇÃO DIRETA DO GOVERNO DO ESTADO DO PARÁ - ASPARÁ;PA;6938258255;2312752751.6666665;1138086452.2062416
ODONT-OPERADORA ODONTOLOGICA LTDA;SP;6827937771;2275979257.0;875479419.6712941
PD BRASIL ASSISTENCIA ODONTOLOGICA LTDA;MG;6666888938;2222296312.6666665;1041722357.2038274
SANTA CASA DE MISERICÓRDIA E BENEFICÊNCIA PORTUGUESA;SP;6310459288;2103486429.3333333;1700733862.249349
UNIODONTO DE LONDRINA COOP. ODONTOLÓGICA;PR;6185536136;2061845378.6666667;968964702.1035596
VALEM ADMINISTRADORA DE BENEFÍCIOS LTDA;MG;6112369875;2037456625.0;918113985.9452914
CAMIM OPERADORA DE PLANO DE SAÚDE LTDA;RJ;6083973846;2027991282.0;1668644073.767094
ASSOCIAÇÃO POLICIAL DE ASSISTÊNCIA À SAÚDE DE JAÚ;SP;5988149547;1996049849.0;688687539.7733393
SANTA CASA DE MISERICÓRDIA E ASILO DOS POBRES DE BATATAIS;SP;5943584820;1981194940.0;716648280.3296305
MEDIATORIE ADMINISTRADORA DE BENEFÍCIOS S/A;ES;5825937014;1941979004.6666667;977596276.2494087
CAIXA DE ASSISTÊNCIA DOS EMPREGADOS DO SETOR PÚBLICO DO ESTADO DE GOIÁS - CAEME;GO;5820485074;1940161691.3333333;914510568.6928204
ASSOCIAÇÃO SAÚDE RURAL ALEGRETE;RS;5740066504;1913355501.3333333;1057578842.5615448
ASSOCIACAO DOS SERVIDORES DA EMDAGRO - ASSEM;SE;5697498805;1899166268.3333333;814418205.8609574
BENEFICENCIA SOCIAL BOM SAMARITANO;MG;5678433974;1892811324.6666667;873260652.7730739
UNIODONTO RS FEDERACAO DAS UNIODONTOS DO RGS LTDA;RS;5367872119;1789290706.3333333;753433895.6511949
UNIODONTO DO SUL GOIANO COOPERATIVA ODONTOLOGICA;GO;5232660566;1744220188.6666667;1295690192.026475
PRESERVE SAUDE ASSISTENCIA MEDICA LTDA;BA;5204271179;1734757059.6666667;1464580185.1078632
CEAM BRASIL - PLANOS DE SAÚDE LTDA;MG;5138758464;5138758464.0;
ODONTOLIVE OPERADORA DE PLANOS ODONTOLÓGICOS LTDA.;SP;5070255292;1690085097.3333333;927382574.2095381
HSMED SAUDE LTDA;RJ;5053616360;1684538786.6666667;1451598307.6165242
ÔNIX OPERADORA DE PLANOS DE SAÚDE LTDA;RJ;4814858154;1604952718.0;672215907.0319867
CORPORE ADMINISTRADORA DE BENEFICIOS DA SAUDE LTDA;SP;4498968810;1499656270.0;750711198.5719272
FUNDO DE ASSISTÊNCIA MÉDICO-HOSPITALAR DO MINISTÉRIO PÚBLICO;MS;4492183243;1497394414.3333333;1125198613.0406806
BENEVIX ADMINISTRADORA DE BENEFÍCIOS LTDA;ES;4429203718;1476401239.3333333;1471866144.3856468
HOSPITAL CESAR LEITE;MG;4381323891;1460441297.0;1302692088.2796273
SALUSMED OPERADORA DE PLANOS DE SAUDE LTDA;SP;4372348337;1457449445.6666667;932619784.8890812
IRMANDADE SANTA CASA DE MISERICÓRDIA DE ITAPEVA;SP;4276547448;1425515816.0;33137363.11442247
COOPERATIVA DE TRABALHO ODONTOLOGICO - UNIODONTO ITAJUBÁ;MG;4169459514;1389819838.0;696307421.1332651
YOU ASSISTÊNCIA MÉDICA LTDA.;MG;4053527736;4053527736.0;
ASSOC DE ASSIST À SAÚDE DOS SERV DAS UNIV E INST FED, EST E/OU FAC PART EM PE;PE;3934724074;1311574691.3333333;471260949.9551999
ASSOCIAÇÃO HOSPITAL SAÚDE DE VARGEM GRANDE DO SUL;SP;3925825467;1308608489.0;1005269461.3794315
QUALIDONTO - QUALIDADE EM ODONTOLOGIA LTDA;BA;3919337379;1306445793.0;729925607.0904634
PLANO DE ASSISTÊNCIA MÉDICA MINEIRA LTDA;MG;3888673415;1296224471.6666667;1007379346.0728374
ASSOCIAÇÃO PADRE PIO PLANOS DE SAÚDE;SP;3840871273;1280290424.3333333;557935125.8696022
ASSOCIAÇÃO SERVIÇOS ODONTOLÓGICOS DA INDÚSTRIA DE MINAS GERAIS - ODONTOINDUSTRIA;MG;3797355601;1265785200.3333333;546947581.6020716
PLATINUM ADMINISTRADORA DE BENEFICIOS;DF;3704916812;1234972270.6666667;685184775.8039755
PLENUM ASSISTENCIA MEDICA  LTDA;DF;3697246236;1848623118.0;1771950489.426076
G2C ADMINISTRADORA DE BENEFICIOS LTDA - ME;RJ;3304047286;1101349095.3333333;716655132.7170852
UP HEALTH ADMINISTRADORA DE BENEFÍCIOS S/A;ES;3193658599;1064552866.3333334;920544602.513629
MEDHEALTH PLANOS DE SAÚDE LTDA;PR;3114804371;1038268123.6666666;528691008.26929075
UNIODONTO DE MATO GROSSO COOP TRAB ODONTOLOGICO LTDA;MT;2995026231;998342077.0;444720883.35270536
ASSOCIAÇÃO DOS FISCAIS DE TRIBUTOS ESTADUAIS DO RS - AFISVEC;RS;2898601271;966200423.6666666;516863093.5636642
HEALTH-MED SISTEMA DE SAUDE LTDA;RJ;2880735434;960245144.6666666;502195720.8959993
SANTA CASA DA MISERICÓRDIA DE SÃO JOÃO DEL REI;MG;2880438071;960146023.6666666;303915461.8249694
BLUZZ SAÚDE S/A;ES;2878850527;959616842.3333334;845019618.2192593
ASSOCIAÇÃO POLICIAL DE ASSISTENCIA A SAUDE DE BOTUCATU;SP;2765062342;921687447.3333334;584982088.6212231
LANCERS ADMINISTRADORA DE BENEFÍCIOS DE SAÚDE LTDA.;SP;2701826570;900608856.6666666;462061600.5975258
CAIXA SEGURADORA ESPECIALIZADA EM SAÚDE S/A;SP;2519434857;839811619.0;602497541.5672772
PLURAL GESTÃO EM PLANOS DE SAÚDE LTDA;RJ;2419806203;806602067.6666666;673024437.735569
PLANO DE ASSISTÊNCIA ODONTOLÓGICA FAUCHARD LTDA. ME;BA;2235601449;745200483.0;567791775.8060652
SAME-SERVIÇO DE ASSISTÊNCIA MÉDICA EMPRESARIAL LTDA.;MA;2226110463;742036821.0;295124095.7193826
SORRIDEN CONVÊNIOS ODONTOLÓGICOS S.A.;SP;2190096974;730032324.6666666;293369432.70192015
ALLCARE ADMINISTRADORA DE BENEFÍCIOS EM SAÚDE LTDA.;DF;2001529918;667176639.3333334;330898463.46569914
INFINITY SAÚDE SUPLEMENTAR LTDA;MT;1916378531;638792843.6666666;368685617.1984705
HOSPITAL DE CARIDADE SÃO VICENTE DE PAULO;PR;1894636514;631545504.6666666;9015613.128530594
CROWN ODONTOLOGIA DE GRUPO LTDA;SP;1856467490;618822496.6666666;512660855.5352951
ALMA ODONTO OPERADORA DE PLANOS ODONTOLOGICOS LTDA;SP;1784907597;594969199.0;144209129.20920444
QUALICORP CLUBE DE SAÚDE ADMINISTRADORA DE BENEFÍCIOS LTDA.;SP;1681610748;560536916.0;817627874.459855
BIORAL SISTEMA ODONTOLÓGICO LTDA.;SP;1677821170;559273723.3333334;182640816.27178735
SERVIX ADMINISTRADORA DE BENEFÍCIOS LTDA;DF;1647131787;549043929.0;245312413.43561217
ODILE SERVIÇOS DE SAÚDE LTDA.;SP;1443226389;481075463.0;272089537.10594964
QV BENEFÍCIOS EM SAÚDE LTDA;RJ;1322645894;440881964.6666667;209937885.8217145
UNIMED FOZ DO IGUACU COOPERATIVA TRABALHO MEDICO;PR;1279518990;639759495.0;359714427.5341013
PLANO SIGMA SAÚDE LTDA;SP;1102353717;551176858.5;30592885.085474767
ODONTO PRIME S/S LTDA;CE;1069553228;356517742.6666667;166827127.83842915
BEMSTAR ASSISTENCIA MEDICA LTDA;BA;1065258595;355086198.3333333;49303600.521595694
SMART CARE SISTEMAS MÉDICOS E ODONTOLÓGICOS LTDA.;SP;865921715;432960857.5;497217182.5449449
BRASIL ODONTO OPERADORA DE PLANOS ODONTOLÓGICOS LTDA;TO;735325454;245108484.66666666;187023771.77515018
INNOVA PLANO DE SAUDE LTDA;RO;681969705;227323235.0;258757218.0217449
ASSISTÊNCIA MÉDICA 12 DE OUTUBRO LTDA;SP;667378650;222459550.0;141605389.6885794
