RAZAO_SOCIAL;UF;total_despesas;media_trimestral;desvio_padrao
BRADESCO SAÚDE S.A.;RJ;41255616284114;13751872094704.666;11534845746223.318
AMIL ASSISTÊNCIA MÉDICA INTERNACIONAL S.A.;SP;29672786010857;9890928670285.666;4316675047439.8657
HAPVIDA ASSISTENCIA MEDICA S.A.;CE;13444051570708;4481350523569.333;2134916901218.818
CAIXA DE ASSISTÊNCIA DOS FUNCIONÁRIOS DO BANCO DO BRASIL;DF;9844886288176;3281628762725.3335;1493157515829.391
NOTRE DAME INTERMÉDICA SAÚDE S.A.;SP;7510449358629;2503483119543.0;1989285075180.9895
UNIMED BELO HORIZONTE COOPERATIVA DE TRABALHO MÉDICO;MG;7352948436322;2450982812107.3335;1154827423141.5234
UNIMED DO EST. DO RJ FEDERAÇÃO EST. DAS COOPERATIVAS MÉDICAS;RJ;6465563579915;2155187859971.6667;822743971163.8875
UNIMED CURITIBA - SOCIEDADE COOPERATIVA DE MÉDICOS;PR;4449480617452;1483160205817.3333;678114043212.3328
UNIMED DE CIANORTE - COOPERATIVA DE TRABALHO MEDICO;PR;4342259424709;1447419808236.3333;10962589764.049639
UNIMED CAMPINAS - COOPERATIVA DE TRABALHO MÉDICO;SP;3862988900534;1287662966844.6667;619212301417.6812
UNIMED PORTO ALEGRE - COOPERATIVA MÉDICA LTDA.;RS;2625700696160;875233565386.6666;664588223582.341
SERV  SOCIAL AUTÔNOMO DE ASSIST À SAÚDE DOS SERV PÚBLICOS E MILITARES DE GOIÁS;GO;2616488051260;1308244025630.0;325661782649.838
GRUPO HOSPITALAR DO RIO DE JANEIRO LTDA;RJ;2331377750790;777125916930.0;664850539065.7518
OMINT SERVIÇOS DE SAÚDE S.A.;SP;2069930544690;689976848230.0;706826901228.6687
UNIMED RECIFE COOPERATIVA DE TRABALHO MÉDICO;PE;1996080214139;665360071379.6666;301345978565.912
FUNDAÇÃO CESP;SP;1977094334656;659031444885.3334;303623972078.566
SAMEDIL SERVIÇOS DE ATENDIMENTO MÉDICO S/A;ES;1838312654234;612770884744.6666;537323135690.4334
BRADESCO SAÚDE - OPERADORA DE PLANOS  S/A;SP;1666489106208;555496368736.0;186543362917.83054
UNIMED GRANDE FLORIANÓPOLIS-COOPERATIVA DE TRABALHO MEDICO;SC;1665253255066;555084418355.3334;259801305948.02124
UNIMED FRANCISCO BELTRAO COOPERATIVA DE TRABALHO MEDICO;PR;1640074832341;546691610780.3333;285830216532.2946
FUNDAÇÃO SAÚDE ITAÚ;MG;1548556567439;516185522479.6667;389309613475.3016
UNIMED DO ESTADO DE SÃO PAULO - FEDERAÇÃO ESTADUAL DAS COOP. MÉDICAS;SP;1431996479938;477332159979.3333;406392787252.8261
UNIMED VITORIA COOPERATIVA DE TRABALHO MEDICO;ES;1355378175644;451792725214.6667;337557707528.16113
NOTRE DAME INTERMÉDICA MINAS GERAIS SAÚDE S.A.;CE;1300123536925;433374512308.3333;201015138035.52765
UNIMED SOROCABA COOPERATIVA DE TRABALHO MÉDICO;SP;1282324126794;427441375598.0;218951241363.02795
UNIMED DE LONDRINA COOPERATIVA DE TRABALHO MÉDICO;PR;1279795756422;426598585474.0;198037088513.40042
ODONTOPREV S/A;SP;1268532335062;422844111687.3333;194523130220.75693
UNIMED SERRA GAUCHA/RS COOPERATIVA DE ASSISTENCIA A SAUDE LTDA;RS;1251705635496;417235211832.0;207131122423.38794
UNIMED MACEIO COOPERATIVA DE TRABALHO MÉDICO;AL;1239655983283;413218661094.3333;186782586213.96707
UNIMED SAO JOSÉ DO RIO PRETO - COOP. DE TRABALHO MÉDICO;SP;1182766426252;394255475417.3333;395136679981.3498
CAIXA BENEFICENTE DOS FUNCIONARIOS DO BANCO DO ESTADO DE SÃO PAULO;SP;1053655249399;351218416466.3333;307150681713.54456
SANTA HELENA ASSISTÊNCIA MÉDICA S/A.;SP;1038117677406;346039225802.0;166060934881.2225
POSTAL SAÚDE CAIXA DE ASSISTÊNCIA E SAÚDE DOS EMPREGADOS DOS CORREIOS;DF;997827325985;332609108661.6667;102962521594.01503
UNIMED UBERLÂNDIA COOPERATIVA REGIONAL TRABALHO MÉDICO LTDA;MG;968012759507;322670919835.6667;137727700155.1365
CENTRO TRASMONTANO DE SAO PAULO;SP;966201074851;322067024950.3333;153783110686.11755
CLINIPAM CLINICA PARANAENSE DE ASSISTENCIA MEDICA LTDA;CE;962919243650;320973081216.6667;159046538005.88937
UNIMED BLUMENAU - COOPERATIVA DE TRABALHO MEDICO;SC;909481308821;303160436273.6667;147031995193.93597
UNIMED DE SANTOS COOP DE TRAB MEDICO;SP;905673383453;301891127817.6667;260394680679.10202
FUNDAÇÃO SÃO FRANCISCO XAVIER;MG;889687877492;296562625830.6667;137159719400.93385
UNIMED DO ESTADO DO PARANÁ FEDERAÇÃO ESTADUAL DAS COOPERATIVAS MÉDICAS;PR;881026489497;293675496499.0;138763842447.57025
UNIMED DO ESTADO DE SANTA CATARINA FED. EST. DAS COOP. MÉD.;SC;869712250549;289904083516.3333;134270039426.68195
UNIMED REGIONAL MARINGÁ COOP.DE TRABALHO MÉDICO;PR;868284816822;289428272274.0;249940915196.77515
ASSOCIAÇÃO DE BENEFICÊNCIA E FILANTROPIA SÃO CRISTOVÃO;SP;828049297895;276016432631.6667;126463424406.79332
UNIMED SAO JOSE DOS CAMPOS - COOPERATIVA DE TRABALHO MEDICO;SP;814323092870;271441030956.66666;126389611995.5752
UNIMED DE PIRACICABA SOCIEDADE COOPERATIVA DE SERVIÇOS MÉDICOS;SP;780908914223;260302971407.66666;126810326173.47327
UNIMED - COOPERATIVA DE SERVIÇOS DE SAÚDE DOS VALES DO TAQUARI E RIO PARDO LTDA.;RS;750704712950;250234904316.66666;119299638332.13768
UNIMED DE JOINVILLE COOPERATIVA DE TRABALHO MÉDICO;SC;747546684820;249182228273.33334;122083776302.58394
UNIMED DE RIBEIRAO PRETO - COOPERATIVA DE TRABALHO MÉDICO;SP;737876677415;245958892471.66666;249403162657.2875
UNIMED-SÃO GONÇALO - NITERÓI - SOC.COOP.SERV.MED E HOSP LTDA;RJ;733040849061;244346949687.0;175611461068.05475
UNIMED DE BAURU COOPERATIVA DE TRABALHO MÉDICO;SP;725821220122;241940406707.33334;111263131101.67732
UNIMED LITORAL COOPERATIVA DE TRABALHO MÉDICO LTDA;SC;713165960706;237721986902.0;115841589911.07986
UNIMED JUIZ DE FORA COOPERATIVA DE TRABALHO MÉDICO LTDA;MG;710714088784;236904696261.33334;110952220667.84938
UNIMED SERGIPE - COOPERATIVA DE TRABALHO MÉDICO;SE;705418259746;235139419915.33334;99278558096.62909
PASA - PLANO DE ASSISTENCIA A SAUDE DO APOSENTADO DA VALE;RJ;654163395233;218054465077.66666;90160350484.25618
ASSOCIAÇÃO PETROBRAS DE SAÚDE - APS;RJ;635557440960;211852480320.0;160113875827.4033
UNIMED DE PRESIDENTE PRUDENTE COOPERATIVA DE TRAB. MÉDICO;SP;584545952643;194848650881.0;97252268312.55992
UNIMED DIVINOPOLIS - COOPERATIVA DE TRABALHO MEDICO LTDA;MG;582500629769;194166876589.66666;191784731899.69617
UNIMED DE CASCAVEL COOPERATIVA DE TRABALHO MÉDICO;PR;582298918660;194099639553.33334;166038203706.6921
UNIMED DE MACAÉ COOPERATIVA DE ASSISTÊNCIA À SAÚDE;RJ;566675634814;188891878271.33334;94497621973.40753
ALICE OPERADORA LTDA.;SP;564572019974;188190673324.66666;102109335729.78267
PARANÁ CLÍNICAS - PLANOS DE SAÚDE S/A;PR;545959046288;181986348762.66666;80176671732.20775
UNIMED JUNDIAI - COOPERATIVA DE TRABALHO MÉDICO;SP;544651142935;181550380978.33334;91182128731.77216
UNIMED DE VOLTA REDONDA COOPERATIVA DE TRABALHO MÉDICO;RJ;541026297642;180342099214.0;84897762367.53584
UNIMED VALE DO SINOS - COOPERATIVA DE ASSISTÊNCIA À SAÚDE LTDA;RS;524528162854;174842720951.33334;87190660919.96074
UNIMED CARUARU-COOPERATIVA DE TRABALHO MEDICO;PE;514709494092;171569831364.0;82011253418.63705
UNIMED NOVA IGUACU COOPERATIVA DE TRABALHO MEDICO;RJ;510257858682;170085952894.0;71390733566.5885
LEVE SAUDE OPERADORA DE PLANOS DE SAUDE S.A;RJ;506674946676;168891648892.0;87852538787.62901
UNIMED NOVA FRIBURGO-SOC.COOP.SERV.MED.HOSP.LTDA.;RJ;500086036417;166695345472.33334;74190729511.01366
UNIMED DE SANTA BÁRBARA D'OESTE E AMERICANA - COOP DE TRABALHO MÉDICO;SP;479513980223;159837993407.66666;77118440599.10219
UNIMED DE MARILIA COOPERATIVA DE TRABALHO MÉDICO;SP;469106967530;156368989176.66666;71994973840.39867
UNIMED VALE DO SÃO FRANCISCO COOPERATIVA DE TRABALHO MÉDICO;PE;462875218488;154291739496.0;73395520386.60153
UNIMED PONTA GROSSA COOPERATIVA DE TRABALHO MEDICO;PR;461990639824;153996879941.33334;69940751710.88823
METRUS INSTITUTO DE SEGURIDADE SOCIAL;SP;461545891680;153848630560.0;55665071705.86481
SAMEL PLANO DE SAÚDE LTDA;AM;451164817659;150388272553.0;75286599730.00868
SOBAM CENTRO MÉDICO HOSPITALAR S.A.;SP;450933157510;150311052503.33334;69120966166.28757
CEMIG SAÚDE;MG;435289227922;145096409307.33334;111277598123.42027
UNIMED REGIONAL DA BAIXA MOGIANA - COOPERATIVA DE TRABALHO MÉDICO;SP;432378276510;144126092170.0;66714554201.69015
MEDISERVICE OPERADORA DE PLANOS DE SAÚDE S.A.;SP;426095026644;142031675548.0;51517413077.70007
FUNDAÇÃO COPEL DE PREVIDÊNCIA E ASSISTÊNCIA SOCIAL;PR;420051460760;140017153586.66666;64679701157.16917
REAL GRANDEZA - FUNDAÇÃO DE PREVIDÊNCIA E ASSISTÊNCIA SOCIAL;RJ;413459642306;137819880768.66666;66256115076.60244
ASSOCIAÇÃO SANTA SAÚDE;SP;412100747489;137366915829.66667;60507251048.799995
CAIXA DE PREVIDÊNCIA E ASSISTÊNCIA DOS SERVIDORES DA FUNDAÇÃO NACIONAL DE SAÚDE - CAPESESP;RJ;401008481444;133669493814.66667;55888734733.05174
ASSOCIAÇÃO DE SAÚDE PORTUGUESA DE BENEFICÊNCIA;SP;398817666027;132939222009.0;66251537671.948395
FUNDAÇÃO CHESF DE ASSISTÊNCIA E SEGURIDADE SOCIAL;PE;396691053563;132230351187.66667;71145655568.2165
ASSOCIACAO DOS AUDITORES FISCAIS DA RECEITA ESTADUAL DE SAO PAULO;SP;390497490373;130165830124.33333;64584627368.429054
COOPERATIVA DE TRABALHO MÉDICO DE POUSO ALEGRE;MG;390066410424;130022136808.0;61799850597.96831
KLINI PLANOS DE SAÚDE LTDA;RJ;382543710664;127514570221.33333;64119720879.6739
UNIMED DO CEARÁ - FEDERAÇÃO DAS SOCIEDADES COOPERATIVAS MÉDICAS DO ESTADO DO CEARÁ LTDA.;CE;380606556440;126868852146.66667;63562084788.869156
HUMANA SAÚDE LTDA.;PR;370833876979;123611292326.33333;116827369083.9347
UNIMED SANTA MARIA/RS - COOPERATIVA DE ASSISTÊNCIA À SAÚDE LTDA;RS;358900386423;119633462141.0;54043118607.34152
UNIMED SALTO/ITU - COOPERATIVA MÉDICA;SP;350937770040;116979256680.0;55293734472.90902
UNIMED CHAPECÓ - COOPERATIVA DE TRABALHO MÉDICO DA REGIÃO OESTE CATARINENSE;SC;340214707285;113404902428.33333;56575095993.89272
UNIMED DE CRICIÚMA COOPERATIVA DE TRABALHO MÉDICO DA REGIÃO CARBONÍFERA;SC;339083114805;113027704935.0;97838948195.39087
UNIMED DE CAMPOS COOPERATIVA DE TRABALHO MÉDICO;RJ;337607919146;112535973048.66667;53266201485.207375
UNIMED PATOS DE MINAS COOPERATIVA TRABALHO MÉDICO LTDA.;MG;331559600001;110519866667.0;50740617284.83545
UNIMED SÃO CARLOS - COOPERATIVA DE TRABALHO MÉDICO;SP;330377524451;110125841483.66667;84303214421.8293
CAIXA DE ASSISTÊNCIA À SAÚDE - CABERJ;RJ;329659430010;109886476670.0;49874135199.66894
UNIMED RONDONOPOLIS COOPERATIVA DE TRABALHO MÉDICO LTDA;MT;327378176307;109126058769.0;50277130679.76464
ASSOCIAÇÃO SANTA CASA SAÚDE DE SÃO JOSÉ DOS CAMPOS;SP;318001083763;106000361254.33333;80735932123.06107
AMPLA PLANOS DE SAUDE LTDA;RJ;315853694023;157926847011.5;37535502038.2669
UNIMED ANHANGUERA COOPERATIVA DE TRABALHO MÉDICO;SP;311810581078;103936860359.33333;47992263396.06302
SERVIÇO SOCIAL DA INDÚSTRIA DO PAPEL, PAPELÃO E CORTIÇA DO ESTADO DE SÃO PAULO - SEPACO;SP;311741652391;103913884130.33333;51779923603.572876
UNIMED DO SUDOESTE COOPERATIVA DE TRABALHO MEDICO LTDA;BA;311611488626;103870496208.66667;46743489106.98105
INTEGRA ASSISTENCIA MEDICA SA;SP;311256396889;103752132296.33333;34435802315.690926
ALVORECER - ASSOCIAÇÃO DE SOCORROS MÚTUOS;SP;308724800050;102908266683.33333;88016500864.19897
AUSTACLINICAS ASSISTÊNCIA MÉDICA E HOSPITALAR LTDA;SP;302675719610;100891906536.66667;48896819197.06424
2CARE OPERADORA DE SAÚDE LTDA.;SP;299079130623;99693043541.0;44675610464.763016
PROMÉDICA - PROTEÇÃO MEDICA A EMPRESAS S.A.;BA;297365377069;99121792356.33333;84580553305.62308
ASSOCIAÇÃO DR. BARTHOLOMEU TACCHINI;RS;289790497411;96596832470.33333;50110246143.24059
UNIMED LESTE PAULISTA COOPERATIVA DE TRABALHO MÉDICO;SP;286171588834;95390529611.33333;44130371278.70168
UNIMED DE BOTUCATU COOPERATIVA DE TRABALHO MÉDICO;SP;285865907762;95288635920.66667;44637424659.75702
UNIMED AMPARO COOPERATIVA DE TRABALHO MÉDICO;SP;285600581048;95200193682.66667;44767143459.52414
UNIMED UBERABA COOPERATIVA DE TRABALHO MEDICO LTDA.;MG;282710014978;94236671659.33333;70789887532.23463
UNIMED SUL CAPIXABA COOPERATIVA DE TRABALHO MÉDICO;ES;282635984084;94211994694.66667;71988356657.99632
FUNDAÇÃO CELESC DE SEGURIDADE SOCIAL - CELOS;SC;280168749593;93389583197.66667;45497295082.581154
UNIMED DE LIMEIRA COOPERATIVA DE TRABALHO MÉDICO;SP;277770800120;92590266706.66667;47320906516.75469
UNIMED GOVERNADOR VALADARES COOP. DE TRABALHO MÉDICO LTDA.;MG;275335328318;91778442772.66667;91365148540.99878
UNIMED DE BEBEDOURO COOPERATIVA DE TRABALHO MÉDICO;SP;271655066278;90551688759.33333;43642411230.485374
ABERTTA SAÚDE - ASSOCIAÇÃO BENEFICENTE DOS EMPREGADOS DA ARCELORMITTAL NO BRASIL;MG;267368774217;89122924739.0;40456415604.889305
ASSOCIAÇÃO EVANGELICA BENEFICENTE DE LONDRINA;PR;266601765124;88867255041.33333;43737061313.58533
SERMED-SAÚDE LTDA.;SP;254340041926;84780013975.33333;40459021255.110146
UNIMED DE ARACATUBA - COOPERATIVA DE TRABALHO MÉDICO;SP;246601545289;82200515096.33333;35421531572.97693
UNIMED DE TUBARAO - COOPERATIVA DE TRABALHO MEDICO DA REGIAO DA AMUREL;SC;244130177626;81376725875.33333;39425641327.691895
UNIMED NOROESTE CAPIXABA COOPERATIVA DE TRABALHO MÉDICO.;ES;241506620174;80502206724.66667;38893870042.38003
IRMANDADE DA SANTA CASA DE MISERICÓRDIA DE PIRACICABA;SP;238565890605;79521963535.0;43386588585.393234
UNIMED DE ARARAQUARA - COOP. DE TRAB. MÉDICO;SP;237220214390;79073404796.66667;61048014493.99753
SÃO LUCAS SAÚDE S/A;SP;236871796873;78957265624.33333;36251089579.402405
UNIMED PATO BRANCO SOCIEDADE COOPERATIVA DE MÉDICOS;PR;231582564494;77194188164.66667;35088109259.04405
SANTA CASA DE MISERICÓRDIA DE JUIZ DE FORA;MG;229209269289;76403089763.0;36144704297.9404
UNIMED PLANALTO MÉDIO/RS - COOPERATIVA DE ASSISTÊNCIA À SAÚDE LTDA.;RS;228809387739;76269795913.0;34356979161.570133
FUNDAÇÃO SANEPAR DE ASSISTÊNCIA SOCIAL;PR;225977068543;75325689514.33333;27086349831.54252
UNIMED COSTA OESTE - COOPERATIVA DE TRABALHO MÉDICO;PR;222660677882;74220225960.66667;64367158162.581505
UNIMED DE RIO CLARO SP COOPERATIVA DE TRABALHO MEDICO;SP;218954309621;72984769873.66667;36443981409.17759
UNIMED NORTE DO MATO GROSSO COOPERATIVA DE TRABALHO MÉDICO;MT;213687745520;71229248506.66667;92484833288.57187
UNIMED ANÁPOLIS COOPERATIVA DE TRABALHO MÉDICO.;GO;212816428821;70938809607.0;29728264318.54044
UNIMED VARGINHA COOPERATIVA DE TRABALHO MÉDICO;MG;209758923721;69919641240.33333;29337305424.85726
UNIMED NOROESTE/RS - SOCIEDADE COOPERATIVA DE ASSISTÊNCIA À SAÚDE LTDA.;RS;209033793482;69677931160.66667;59665517709.3998
UNIMED DE OURINHOS - COOPERATIVA DE TRABALHO MÉDICO;SP;206301391167;68767130389.0;32479707430.58789
UNIMED RIO BRANCO COOPERATIVA DE TRABALHO MEDICO LTDA;AC;202818112239;67606037413.0;57675786389.652504
MÚTUA DOS MAGISTRADOS DO ESTADO DO RIO DE JANEIRO;RJ;201343887085;67114629028.333336;32020726641.235893
ECONOMUS INSTITUTO DE SEGURIDADE SOCIAL;SP;199945256663;66648418887.666664;33169377701.92735
PLANO DE SAÚDE DA SANTA CASA DE BRAGANÇA PAULISTA;SP;198894731383;66298243794.333336;31942979455.821045
UNIMED TEOFILO OTONI COOPERATIVA DE TRABALHO MÉDICO;MG;195991202989;65330400996.333336;28851311152.28127
UNIMED REGIONAL DE CAMPO MOURÃO COOP TRAB MEDICO;PR;194328672902;64776224300.666664;30058981020.670506
UNIMED MONTES CLAROS COOPERATIVA DE  TRABALHO MÉDICO LTDA.;MG;193092701799;64364233933.0;24149449205.437977
UNIMED ENCOSTA DA SERRA/RS SOCIEDADE COOPERATIVA DE SERVIÇOS DE SAÚDE LTDA.;RS;186141379454;62047126484.666664;29688290459.551365
UNIMED PETROPOLIS-RJ COOPERATIVA DE TRABALHO MÉDICO;RJ;185538253468;61846084489.333336;64301497782.543785
UNIMED METROPOLITANA DO AGRESTE - COOPERATIVA DE TRABALHO MÉDICO;AL;185217763721;61739254573.666664;27883176369.807415
CIRCULO OPERARIO CAXIENSE;RS;183651545158;61217181719.333336;46440601073.03135
UNIMED COSTA DO DESCOBRIMENTO COOPERATIVA DE TRABALHO MÉDICO;BA;181797920167;60599306722.333336;28435386860.744724
SELECT OPERADORA DE PLANO DE SAUDE LTDA;GO;175641460361;58547153453.666664;46253161552.9298
UNIMED NORTE CAPIXABA- COOPERATIVA DE TRABALHO MÉDICO;ES;175530192019;58510064006.333336;28661009046.516506
CAIXA DE ASSISTENCIA A SAUDE DA UNIVERSIDADE;MG;170852031634;56950677211.333336;26471312810.041157
UNIMED FRANCA - SOCIEDADE COOPERATIVA DE SERVIÇOS MÉDICOS E HOSPITALARES;SP;170628510739;56876170246.333336;73961554446.2207
ASSOCIAÇÃO ADVENTISTA NORTE BRASILEIRA DE PREVENÇÃO E ASSISTÊNCIA A SAÚDE;PA;169919123529;56639707843.0;25948683114.40977
UNIMED GUARAPUAVA COOPERATIVA DE TRABALHO MÉDICO;PR;169127270243;56375756747.666664;24944557181.251305
SIM - CAIXA DE ASSISTÊNCIA À SAÚDE;SC;164862438400;54954146133.333336;25356150868.617672
COOPERATIVA CENTRAL UNIMED DE COOPERATIVAS DE ASSISTÊNCIA À SAÚDE DO RIO GRANDE DO SUL LTDA.;RS;163685856521;54561952173.666664;70904016692.81413
ASSOCIAÇÃO DA SANTA CASA SAÚDE DE RIBEIRÃO PRETO;SP;162875725042;54291908347.333336;23928039081.56993
IRMANDADE SANTA CASA DE MISERICÓRDIA DE MARINGÁ;PR;162659753781;54219917927.0;27355367932.80227
UNIMED VALE DO CAÍ/RS - COOPERATIVA DE ASSISTÊNCIA À SAÚDE LTDA.;RS;161542954790;53847651596.666664;25554672872.24436
UNIMED DE ASSIS COOPERATIVA DE TRABALHO MÉDICO;SP;158431829607;52810609869.0;24116031312.925934
FUNDAÇAO COMPESA DE PREVIDENCIA E ASSISTENCIA - COMPESAPREV;PE;156696392191;52232130730.333336;23655393515.572197
ASSOCIAÇÃO SÃO FRANCISCO VIDA;SP;154467531596;51489177198.666664;25294132342.406075
UNIMED EXTREMO SUL COOPERATIVA DE TRABALHO MÉDICO;BA;152561827807;50853942602.333336;21709312267.877705
UNIMED NORTE FLUMINENSE COOPERATIVA DE TRABALHO MEDICO;RJ;150835213741;50278404580.333336;22458920536.918797
UNIMED VALE DO AÇO COOPERATIVA DE TRABALHO MÉDICO;MG;148465057056;74232528528.0;26550691019.390797
UNIMED DE PARANAGUÁ COOPERATIVA DE TRABALHO MÉDICO;PR;145797977376;48599325792.0;22291073168.73767
AMESC - ASSOCIAÇÃO MÉDICA ESPÍRITA CRISTÃ;RJ;144215163540;48071721180.0;21292517878.22574
UNIMED PALMAS COOPERATIVA DE TRABALHO MÉDICO;TO;142140992657;47380330885.666664;45286569263.972626
LUMINAR SAÚDE - ASSOCIAÇÃO DE ASSISTÊNCIA À SAÚDE;DF;141799577060;47266525686.666664;18033541533.877968
AMEPLAN ASSISTÊNCIA MÉDICA PLANEJADA LTDA;SP;141586028307;47195342769.0;12470789681.446041
UNIMED PELOTAS/RS - COOPERATIVA DE ASSISTÊNCIA À SAÚDE LTDA.;RS;140629953419;46876651139.666664;35621871929.28887
UNIMED DE DOURADOS COOPERATIVA DE TRABALHO MÉDICO LTDA;MS;140555200398;46851733466.0;35539035803.93223
UNIMED RESENDE COOPERATIVA DE TRABALHO MÉDICO;RJ;139407221523;46469073841.0;23816802282.934414
S.P.A SAUDE- SISTEMA DE PROMOÇÃO ASSISTENCIAL;SP;137147072061;45715690687.0;67882804110.66955
ASSOCIAÇÃO PADRE ALBINO SAÚDE;SP;136171741391;45390580463.666664;23199224581.72758
CAIXA ASSISTENCIAL E BENEFICENTE DOS FUNCIONÁRIOS DA ACARESC;SC;132680167244;44226722414.666664;19021959916.817467
UNIMED POÇOS DE CALDAS - SOC. COOP. DE TRAB. E SERVIÇOS MÉDICOS;MG;130931233732;43643744577.333336;37814927342.140076
UNIMED SAÚDE E ODONTO S.A;SP;130860997101;43620332367.0;21452334419.793705
UNIMED REGIONAL SUL GOIAS COOP. DE TRABALHO MÉDICO LTDA;GO;130524587579;43508195859.666664;20467273016.63454
UNIMED CURVELO COOPERATIVA DE TRABALHO MÉDICO LTDA.;MG;127475039601;42491679867.0;36397013940.21208
UNIMED OESTE DO PARÁ - COOPERATIVA DE TRABALHO MÉDICO;PA;127315584031;42438528010.333336;16886357110.145117
ASSOCIAÇÃO DOS SERVIDORES FISCAIS DO ESTADO DA BAHIA;BA;126629356205;42209785401.666664;20362416324.168407
ASSOCIAÇAO DOS FUNCIONARIOS PUBLICOS DO ESTADO DO RIO GRANDE DO SUL;RS;126331619342;42110539780.666664;15377415632.078527
SUL AMÉRICA SEGURADORA DE SAÚDE S.A.;SP;125710961735;125710961735.0;
ASSOCIAÇÃO SANTA CASA SAÚDE DE ARAÇATUBA;SP;125580442429;41860147476.333336;18735278988.89883
UNIMED CONSELHEIRO LAFAIETE COOPERATIVA DE TRABALHO MÉDICO LTDA;MG;124707833886;41569277962.0;41767542532.38516
UNIMED APUCARANA COOPERATIVA DE TRABALHO MÉDICO;PR;124562568044;41520856014.666664;18740566697.21432
ELOSAÚDE - ASSOCIAÇÃO DE ASSISTÊNCIA À SAÚDE;SC;124401290249;41467096749.666664;19487687817.469364
FUNDAÇÃO DE SEGURIDADE SOCIAL DA ARCELORMITTAL BRASIL - FUNSSEST;ES;124194745449;41398248483.0;15651465264.816368
UNIMED JOÃO MONLEVADE COOPERATIVA DE TRABALHO MÉDICO LTDA.;MG;121902352148;40634117382.666664;17991505176.430355
UNIMED SÃO JOÃO DEL REI - COOPERATIVA DE TRABALHO MÉDICO;MG;121587875873;40529291957.666664;17910456151.053596
UNIMED DE SÃO ROQUE - COOPERATIVA DE TRABALHO MÉDICO;SP;121032989534;40344329844.666664;35151135869.16626
AGROS - INSTITUTO UFV DE SEGURIDADE SOCIAL;MG;119658278040;39886092680.0;17724300783.437954
BENEFICENCIA CAMILIANA DO SUL;SP;118902166803;59451083401.5;75336464600.31073
CAIXA DE ASSISTÊNCIA DOS EMPREGADOS DA SANEAGO;GO;118774784287;39591594762.333336;17482088354.173187
IRMANDADE DA SANTA CASA DE MISERICÓRDIA DE RIO CLARO;SP;118736989837;39578996612.333336;34810096836.63868
GOCARE PLANOS DE SAUDE LTDA;SP;118238535579;39412845193.0;13999234668.023754
CAIXA DE ASSISTÊNCIA DOS SERVIDORES FAZENDÁRIOS ESTADUAIS;CE;117645097832;39215032610.666664;18242053791.21408
UNIMED PARÁ DE MINAS COOPERATIVA DE TRABALHO MÉDICO LTDA.;MG;116549770914;38849923638.0;17991385542.282696
UNIMED FRONTEIRA NOROESTE/RS - COOPERATIVA DE ASSISTÊNCIA À SAÚDE LTDA.;RS;115485329606;38495109868.666664;17508550485.946026
UNIMED DE PARANAVAÍ COOPERATIVA DE TRABALHO MÉDICO;PR;115030930263;38343643421.0;32823346279.46709
UNIMED BARRA DO GARÇAS - COOPERATIVA DE TRABALHO MÉDICO;MT;113015892748;37671964249.333336;37170862911.2389
ASSOCIAÇÃO BENEFICENTE DOS PROFESSORES PÚBLICOS ATIVOS E INATIVOS DO RIO DE JANEIRO - APPAI;RJ;112276484746;37425494915.333336;37706850221.299835
UNIMED ERECHIM - COOPERATIVA DE SERVIÇOS DE SAÚDE LTDA.;RS;111861626838;37287208946.0;17160875766.650404
UNIMED ITAJUBA COOPERATIVA DE TRABALHO MEDICO;MG;110471551832;36823850610.666664;19012959065.177498
UNIMED BARBACENA - COOPERATIVA DE TRABALHO MÉDICO LTDA;MG;107882023528;35960674509.333336;17615768691.840492
SUL AMÉRICA ODONTOLÓGICO S/A;SP;107706377634;35902125878.0;15329741841.858566
UNIMED CENTRO SUL FLUMINENSE COOPERATIVA DE TRABALHO MÉDICO;RJ;107320772052;35773590684.0;17557667883.21337
NOVA SAÚDE OPERADORA INTEGRADA DE SAÚDE LTDA;RJ;106983255227;35661085075.666664;20067035113.64389
ESMALE ASSISTENCIA INTERNACIONAL DE SAUDE LTDA.;AL;105745606950;35248535650.0;14230419062.405827
UNIMED DE BARRA MANSA SOC. COOP. SERV.MED.E HOSPIT.;RJ;105459512307;35153170769.0;35831883954.279335
CAIXA DE ASSISTÊNCIA DOS EMPREGADOS DO SISTEMA FINANCEIRO BANESTES;ES;104707707442;34902569147.333336;14782737837.074476
UNIMED ARAGUARI COOPERATIVA DE TRABALHO MÉDICO;MG;104465896100;34821965366.666664;15654373611.756596
PARANA ASSISTENCIA MEDICA LTDA;PR;103764939090;34588313030.0;15256101923.003885
UNIMED DE LINS - COOPERATIVA DE TRABALHOS MÉDICOS;SP;103368460783;34456153594.333336;14698538132.053566
VIVACOM PLANOS DE SAÚDE;GO;103226915999;34408971999.666664;15370742323.980072
UNIMED NOROESTE DO PARANÁ COOP DE TRABALHO MÉDICO .;PR;102593300641;34197766880.333332;16539738976.840187
AMHE MED ASSISTENCIA A SAUDE LTDA - EPP;SP;100340867331;33446955777.0;25136003978.052525
UNIMED DE CAÇAPAVA - COOPERATIVA DE TRABALHO MEDICO;SP;98413760299;32804586766.333332;28203382557.78052
UNIMED EXTREMO OESTE CATARINENSE COOPERATIVA DE TRABALHO MÉDICO;SC;98171377464;32723792488.0;14190944585.179983
IRMANDADE DA SANTA CASA DE MISERICORDIA DE LIMEIRA;SP;97037588753;32345862917.666668;16180140500.57128
PLAMED PLANO DE ASSISTENCIA MEDICA LTDA;SE;96563418094;32187806031.333332;15670778396.726585
UNIMED NORTE PIONEIRO - COOPERATIVA DE TRABALHO MÉDICO;PR;95354389260;31784796420.0;14960060452.884945
UNIMED MURIAÉ COOPERATIVA DE TRABALHO MEDICO LTDA;MG;95151423562;31717141187.333332;14563887123.051561
DENTAL UNI - COOPERATIVA ODONTOLÓGICA;PR;94717434500;31572478166.666668;15309936091.734066
FUNDACAO LEONOR DE BARROS CAMARGO;SP;94392907619;31464302539.666668;14693635318.250135
UNIMED DE CATANDUVA - COOPERATIVA DE TRABALHO MÉDICO;SP;93593713059;31197904353.0;23091680035.63939
SULMED - ASSISTÊNCIA MÉDICA LTDA;RS;90175291585;30058430528.333332;14601463628.635641
UNIMED ALTA MOGIANA COOPERATIVA DE TRABALHO MÉDICO;SP;89196623313;29732207771.0;14627904862.639847
UNIMED VALE DAS ANTAS, RS - COOPERATIVA DE ASSISTÊNCIA À SAÚDE LTDA.;RS;89148481710;29716160570.0;10171571078.949095
GARANTIA DE SAÚDE LTDA;SP;88661314149;29553771383.0;25166177717.254036
BEST SENIOR OPERADORA DE SAÚDE LTDA;ES;87506690702;29168896900.666668;17485996754.889603
UNIMED DE JABOTICABAL COOP. DE TRABALHO MÉDICO;SP;87398880411;29132960137.0;29690182805.114124
PRONTOMED PLANOS DE SAÚDE LTDA;MG;86392192326;28797397442.0;12873652077.731253
MATÃO CLINICAS & AMHMA SAÚDE LTDA;SP;85795853640;28598617880.0;13230800732.333258
ASSOCIAÇÃO DE SAÚDE DO VALE;SC;85037886794;28345962264.666668;14116333553.696642
ASSISTÊNCIA MÉDICA SÃO MIGUEL LTDA;SP;84941318527;28313772842.333332;28834579586.622078
UNIMED ITABIRA COOPERATIVA DE TRABALHO MÉDICO;MG;83113337310;27704445770.0;27295144563.825756
UNIMED DE GUARULHOS COOPERATIVA DE TRABALHO MÉDICO;SP;82847941911;27615980637.0;24626308526.07004
UNIMED INCONFIDENTES COOPERATIVA DE TRABALHO MÉDICO LTDA.;MG;82805718464;27601906154.666668;21302379000.744915
ASSOCIAÇÃO DE SAÚDE DOS FORNECEDORES DE CANA DE PIRACICABA E REGIÃO;SP;82556792417;27518930805.666668;14703899323.068434
SAMI ASSISTÊNCIA MÉDICA LTDA;SP;82424264189;27474754729.666668;26179474548.65155
UNIMED ARAXÁ COOPERATIVA DE TRABALHO MÉDICO LTDA.;MG;82179304662;27393101554.0;27276851760.935944
UNIMED SÃO LOURENÇO COOPERATIVA DE TRABALHO MÉDICO;MG;82082360664;27360786888.0;12361184510.118027
UNIMED ITAÚNA COOPERATIVA DE TRABALHO MÉDICO LTDA.;MG;81736503968;27245501322.666668;11803050327.959932
ASSOCIAÇÃO MINEIRA DE ASSISTÊNCIA À SAÚDE DOS MEMBROS DO MINISTÉRIO PÚBLICO;MG;81381101804;27127033934.666668;13547317096.554274
FEDERAÇÃO DAS SOCIEDADES COOPERATIVAS DE TRABALHO MÉDICO DO ACRE, AMAPÁ, AMAZONAS, PARÁ, RONDONIA E RORAIMA;AM;81129577653;81129577653.0;
ASSOCIAÇÃO DO PLANO DE SAÚDE DA SANTA CASA DE MISERICÓRDIA DE ITABUNA - PLANSUL;BA;81082666019;27027555339.666668;11735702734.891926
