RAZAO_SOCIAL;UF;total_despesas;media_trimestral;desvio_padrao
LIVRI OPERADORA DE PLANO DE SAÚDE LTDA;SP;535551988;178517329.33333334;4911345.338827371
G & M ASSESSORIA MEDICA EMPRESARIAL LTDA;RJ;500849997;166949999.0;122550871.10959308
LIFE CLASS ADMINISTRADORA DE BENEFICIOS LTDA.;SP;420915687;140305229.0;21012244.935895283
UNIVIDA USA OPERADORA EM SAUDE S/A;SP;402672555;402672555.0;
POLIMÉDICA SAÚDE SOCIEDADE SIMPLES LTDA;RS;336098083;112032694.33333333;145942311.82054266
EVO SAUDE ASSISTENCIA MEDICA LTDA;DF;317724999;105908333.0;165155903.177135
INTERCLINICAS PLANO VIDA USA OPERADORA DE SAUDE LTDA;SP;310962271;155481135.5;184459525.73263404
CLÍNICA SÃO GABRIEL S/S LTDA;SP;280869200;93623066.66666667;43711428.01634591
SAUDIA ASSISTENCIA MÉDICA LTDA;MG;273638848;91212949.33333333;60489673.588666156
MUITO MAIS SAÚDE ADMINISTRADORA DE BENEFÍCIOS;RJ;255108896;85036298.66666667;66705696.43173663
SAGRADA SAÚDE ASSISTÊNCIA MÉDICA LTDA;MG;220795825;73598608.33333333;71381085.29835212
EXCELÊNCIA PLANO DE SAÚDE S/A;ES;128604532;42868177.333333336;36292618.45432761
A.P.S. ADMINISTRADORA DE BENEFÍCOS LTDA.;SP;124054506;41351502.0;54023546.92499307
UNICONSULT - ADMINISTRADORA DE BENEFICIOS E SERVICOS LTDA;SP;96642992;96642992.0;
VCT PLANOS DE SAUDE LTDA;MG;91600821;91600821.0;
AIRES OPERADORA DE SAUDE LTDA;PE;77193462;77193462.0;
UNICOR ADMINISTRADORA DE BENEFICIOS LTDA;MG;76658626;25552875.333333332;25677099.94127042
QUALI ADMINISTRADORA DE BENEFÍCIOS S/A;ES;76302549;76302549.0;
SOCIODONTO PLANO DE ASSISTÊNCIA ODONTOLÓGICA LTDA;MG;70534596;35267298.0;33781737.97162058
CENTRAL OPERADORA DE PLANOS DE SAÚDE NORTE-NORDESTE LTDA;PB;52940870;17646956.666666668;30399697.728212368
UNIMED PARAIBA - FEDERAÇAO DAS SOCIEDADES COOPERATIVAS DE TRABALHO MEDICO;PB;45401437;15133812.333333334;1967430.8444248638
LEXUS ADMINISTRADORA DE BENEFICIOS LTDA;SP;37313936;12437978.666666666;15426646.677796487
UP SOLUÇÕES EM SAÚDE LTDA;SP;33261272;33261272.0;
SAUDE SALV ASSISTENCIA MEDICA LTDA;RO;32014257;32014257.0;
ESPLENDOR ADMINISTRADORA DE BENEFÍCIOS LTDA.;DF;26648229;8882743.0;7185447.41173081
SALVE SAÚDE ADMINISTRADORA DE BENEFÍCIOS LTDA;RJ;23708960;7902986.666666667;3473197.007561381
SALUPLAN ADMINISTRADORA DE BENEFÍCIOS LTDA;SP;19550446;6516815.333333333;3894498.829600714
ZURICH SANTANDER BRASIL ODONTO LTDA.;SP;14282030;14282030.0;
VITTA SAUDE ADMINISTRADORA DE BENEFICIOS LTDA.;SP;3120958;1040319.3333333334;1595588.5359779736
SAUDE VIVA ADMINISTRADORA DE BENEFICIOS LTDA;SP;3037666;1012555.3333333334;408766.2999873318
ARL ADMINISTRADORA DE BENEFÍCIOS LTDA.;SP;1564186;782093.0;62067.0048254304
INTERVIDA ADMINISTRADORA DE BENEFÍCIOS LTDA;SP;1260500;420166.6666666667;125033.32889007368
BENEFIT ADMINISTRADORA DE BENEFÍCIOS LTDA.;SP;900000;300000.0;150000.0
NEXO - ADMINISTRADORA DE BENEFICIOS LTDA;SP;600000;200000.0;0.0
CLICSAUDE ADMINISTRADORA DE BENEFICIOS LTDA;SP;27345;9115.0;14338.028978907805
GESTAO VIDA ADMINISTRADORA DE BENEFICIOS LTDA.;SP;5160;2580.0;3648.670990922585
MAXIMED PLANOS DE SAUDE LTDA;RJ;30;30.0;
PRO-SAUDE JARINU ASSISTENCIA MEDICA SUPLEMENTAR LTDA.;SP;0;0.0;0.0
TOTAL SAUDE  ADMINISTRADORA DE BENEFICIOS EIRELI;ES;0;0.0;0.0
UNIC ASSISTENCIA MEDICA LTDA;SP;0;0.0;
ELITE SAUDE SERVICOS MEDICOS LTDA.;SP;0;0.0;0.0
HEALTH ADMINISTRADORA DE BENEFICIOS LTDA;SP;0;0.0;
JURAL ADMINISTRADORA DE BENEFICIOS LTDA;SP;0;0.0;
BCI ADMINISTRADORA DE BENEFÍCIOS LTDA.;SP;0;0.0;0.0
ATIMED ASSISTENCIA MEDICA LTDA;SP;0;0.0;
BIT LIFE BENEFÍCIOS LTDA;SP;0;0.0;0.0
AMPLITUDE PLANOS DE SAUDE LTDA;MG;0;0.0;0.0
VROCCHI WAY ADMINISTRADORA DE BENEFICIOS LTDA;SP;0;0.0;
